{
  "catalog": "gantry.host-domain-contracts",
  "major": 1,
  "minor": 0,
  "schema": "gantry.host-domain-contracts/v1",
  "schema_path": "protocol/schemas/host-domain-contracts-v1.schema.json",
  "specification_revision": "293136ab2847bd3a47776866ed24af40875e3b00449c5ae587425da1d8bdaac8",
  "families": [
    {
      "wire": "codec",
      "rust": "Codec",
      "categories": [
        "decode",
        "encode",
        "malformed-input",
        "resource-limit",
        "unclassified"
      ],
      "targets": [
        "application",
        "durable",
        "portable"
      ]
    },
    {
      "wire": "console",
      "rust": "Console",
      "categories": [
        "closed",
        "interrupted",
        "read",
        "write",
        "unclassified"
      ],
      "targets": [
        "application"
      ]
    },
    {
      "wire": "dns",
      "rust": "Dns",
      "categories": [
        "lookup",
        "name-not-found",
        "temporary",
        "unclassified"
      ],
      "targets": [
        "application"
      ]
    },
    {
      "wire": "environment",
      "rust": "Environment",
      "categories": [
        "access-denied",
        "missing",
        "read",
        "write",
        "unclassified"
      ],
      "targets": [
        "application"
      ]
    },
    {
      "wire": "filesystem",
      "rust": "Filesystem",
      "categories": [
        "access-denied",
        "already-exists",
        "missing",
        "read",
        "write",
        "unclassified"
      ],
      "targets": [
        "application"
      ]
    },
    {
      "wire": "http",
      "rust": "Http",
      "categories": [
        "body",
        "protocol",
        "request",
        "response",
        "unclassified"
      ],
      "targets": [
        "application"
      ]
    },
    {
      "wire": "process",
      "rust": "Process",
      "categories": [
        "exit",
        "launch",
        "reap",
        "signal",
        "wait",
        "unclassified"
      ],
      "targets": [
        "application"
      ]
    },
    {
      "wire": "randomness",
      "rust": "Randomness",
      "categories": [
        "entropy-unavailable",
        "invalid-request",
        "unclassified"
      ],
      "targets": [
        "application"
      ]
    },
    {
      "wire": "secret",
      "rust": "Secret",
      "categories": [
        "access-denied",
        "missing",
        "provider-failure",
        "unclassified"
      ],
      "targets": [
        "application"
      ]
    },
    {
      "wire": "socket",
      "rust": "Socket",
      "categories": [
        "bind",
        "connect",
        "read",
        "write",
        "unclassified"
      ],
      "targets": [
        "application"
      ]
    },
    {
      "wire": "time",
      "rust": "Time",
      "categories": [
        "clock-unavailable",
        "deadline",
        "sleep",
        "unclassified"
      ],
      "targets": [
        "application"
      ]
    },
    {
      "wire": "tls",
      "rust": "Tls",
      "categories": [
        "certificate",
        "handshake",
        "protocol",
        "unclassified"
      ],
      "targets": [
        "application"
      ]
    }
  ],
  "negative_fixtures": [
    "incomplete-target-mappings",
    "mismatched-family-category",
    "missing-unclassified",
    "native-detail-in-portable-field",
    "unknown-family-category"
  ]
}
